Author,Title,Year,Url,Content,Chapter,Page_num,Word_count
Charlotte Bronte,Jane Eyre,1847,https://www.literaturepage.com/read/janeeyre-126.html,"The promise of a smooth career, which my first calm introduction to Thornfield Hall seemed to pledge, was not belied on a longer acquaintance with the place and its inmates. Mrs. Fairfax turned out to be what she appeared, a placid-tempered, kind-natured woman, of competent education and average intelligence. My pupil was a lively child, who had been spoilt and indulged, and therefore was sometimes wayward; but as she was committed entirely to my care, and no injudicious interference from any quarter ever thwarted my plans for her improvement, she soon forgot her little freaks, and became obedient and teachable. She had no great talents, no marked traits of character, no peculiar development of feeling or taste which raised her one inch above the ordinary level of childhood; but neither had she any deficiency or vice which sunk her below it. She made reasonable progress, entertained for me a vivacious, though perhaps not very profound, affection; and by her simplicity, gay prattle, and efforts to please, inspired me, in return, with a degree of attachment sufficient to make us both content in each other's society. This, par parenthese, will be thought cool language by persons who entertain solemn doctrines about the angelic nature of children, and the duty of those charged with their education to conceive for them an idolatrous devotion: but I am not writing to flatter parental egotism, to echo cant, or prop up humbug; I am merely telling the truth. I felt a conscientious solicitude for Adele's welfare and progress, and a quiet liking for her little self: just as I cherished towards Mrs. Fairfax a thankfulness for her kindness, and a pleasure in her society proportionate to the tranquil regard she had for me, and the moderation of her mind and character. Anybody may blame me who likes, when I add further, that, now and then, when I took a walk by myself in the grounds; when I went down to the gates and looked through them along the road; or when, while Adele played with her nurse, and Mrs. Fairfax made jellies in the storeroom, I climbed the three staircases, raised the trap-door of the attic, and having reached the leads, looked out afar over sequestered field and hill, and along dim sky-line--that then I longed for a power of vision which might overpass that limit; which might reach the busy world, towns, regions full of life I had heard of but never seen--that then I desired more of practical experience than I possessed; more of intercourse with my kind, of acquaintance with variety of character, than was here within my reach. I valued what was good in Mrs. Fairfax, and what was good in Adele; but I believed in the existence of other and more vivid kinds of goodness, and what I believed in I wished to behold.",12. CHAPTER XII,126,474
Louisa May Alcott,Little Women,1868,https://www.literaturepage.com/read/littlewomen-113.html,"As spring came on, a new set of amusements became the fashion, and the lengthening days gave long afternoons for work and play of all sorts. The garden had to be put in order, and each sister had a quarter of the little plot to do what she liked with. Hannah used to say, ""I'd know which each of them gardings belonged to, ef I see 'em in Chiny,"" and so she might, for the girls' tastes differed as much as their characters. Meg's had roses and heliotrope, myrtle, and a little orange tree in it. Jo's bed was never alike two seasons, for she was always trying experiments. This year it was to be a plantation of sun flowers, the seeds of which cheerful land aspiring plant were to feed Aunt Cockle-top and her family of chicks. Beth had old-fashioned fragrant flowers in her garden, sweet peas and mignonette, larkspur, pinks, pansies, and southernwood, with chickweed for the birds and catnip for the pussies. Amy had a bower in hers, rather small and earwiggy, but very pretty to look at, with honeysuckle and morning-glories hanging their colored horns and bells in graceful wreaths all over it, tall white lilies, delicate ferns, and as many brilliant, picturesque plants as would consent to blossom there. Gardening, walks, rows on the river, and flower hunts employed the fine days, and for rainy ones, they had house diversions, some old, some new, all more or less original. One of these was the `P.C', for as secret societies were the fashion, it was thought proper to have one, and as all of the girls admired Dickens, they called themselves the Pickwick Club. With a few interruptions, they had kept this up for a year, and met every Saturday evening in the big garret, on which occasions the ceremonies were as follows: Three chairs were arranged in a row before a table on which was a lamp, also four white badges, with a big `P.C.' in different colors on each, and the weekly newspaper called, The Pickwick Portfolio, to which all contributed something, while Jo, who reveled in pens and ink, was the editor. At seven o'clock, the four members ascended to the clubroom, tied their badges round their heads, and took their seats with great solemnity. Meg, as the eldest, was Samuel Pickwick, Jo, being of a literary turn, Augustus Snodgrass, Beth, because she was round and rosy, Tracy Tupman, and Amy, who was always trying to do what she couldn't, was Nathaniel Winkle. Pickwick, the president, read the paper, which was filled with original tales, poetry, local news, funny advertisements, and hints, in which they good-naturedly reminded each other of their faults and short comings. On one occasion, Mr. Pickwick put on a pair of spectacles without any glass, rapped upon the table, hemmed, and having stared hard at Mr. Snodgrass, who was tilting back in his chair, till he arranged himself properly, began to read:",PART 1 10. CHAPTER TEN,113,493
Anne Bronte,The Tenant of Wildfowl Hall,1848,https://www.literaturepage.com/read/tenant-of-wildfell-hall-76.html,"Miss Wilson drew herself up with a look of freezing scorn, but said nothing. Eliza would have replied, but I interrupted her by saying as calmly as I could, though in a tone which betrayed, no doubt, some little of what I felt within, - 'We have had enough of this subject; if we can only speak to slander our betters, let us hold our tongues.' 'I think you'd better,' observed Fergus, 'and so does our good parson; he has been addressing the company in his richest vein all the while, and eyeing you, from time to time, with looks of stern distaste, while you sat there, irreverently whispering and muttering together; and once he paused in the middle of a story or a sermon, I don't know which, and fixed his eyes upon you, Gilbert, as much as to say, ""When Mr. Markham has done flirting with those two ladies I will proceed.""' What more was said at the tea-table I cannot tell, nor how I found patience to sit till the meal was over. I remember, however, that I swallowed with difficulty the remainder of the tea that was in my cup, and ate nothing; and that the first thing I did was to stare at Arthur Graham, who sat beside his mother on the opposite side of the table, and the second to stare at Mr. Lawrence, who sat below; and, first, it struck me that there was a likeness; but, on further contemplation, I concluded it was only in imagination. Both, it is true, had more delicate features and smaller bones than commonly fall to the lot of individuals of the rougher sex, and Lawrence's complexion was pale and clear, and Arthur's delicately fair; but Arthur's tiny, somewhat snubby nose could never become so long and straight as Mr. Lawrence's; and the outline of his face, though not full enough to be round, and too finely converging to the small, dimpled chin to be square, could never be drawn out to the long oval of the other's, while the child's hair was evidently of a lighter, warmer tint than the elder gentleman's had ever been, and his large, clear blue eyes, though prematurely serious at times, were utterly dissimilar to the shy hazel eyes of Mr. Lawrence, whence the sensitive soul looked so distrustfully forth, as ever ready to retire within, from the offences of a too rude, too uncongenial world. Wretch that I was to harbour that detestable idea for a moment! Did I not know Mrs. Graham? Had I not seen her, conversed with her time after time? Was I not certain that she, in intellect, in purity and elevation of soul, was immeasurably superior to any of her detractors; that she was, in fact, the noblest, the most adorable, of her sex I had ever beheld, or even imagined to exist? Yes, and I would say with Mary Millward (sensible girl as she was), that if all the parish, ay, or all the world, should din these horrible lies in my ears, I would not believe them, for I knew her better than they.",9. CHAPTER IX (continued),76,521
Jane Austen,Pride and Prejudice,1811,https://www.literaturepage.com/read/prideandprejudice-178.html,"""I had not been long in Hertfordshire, before I saw, in common with others, that Bingley preferred your elder sister to any other young woman in the country. But it was not till the evening of the dance at Netherfield that I had any apprehension of his feeling a serious attachment. I had often seen him in love before. At that ball, while I had the honour of dancing with you, I was first made acquainted, by Sir William Lucas's accidental information, that Bingley's attentions to your sister had given rise to a general expectation of their marriage. He spoke of it as a certain event, of which the time alone could be undecided. From that moment I observed my friend's behaviour attentively; and I could then perceive that his partiality for Miss Bennet was beyond what I had ever witnessed in him. Your sister I also watched. Her look and manners were open, cheerful, and engaging as ever, but without any symptom of peculiar regard, and I remained convinced from the evening's scrutiny, that though she received his attentions with pleasure, she did not invite them by any participation of sentiment. If YOU have not been mistaken here, I must have been in error. Your superior knowledge of your sister must make the latter probable. If it be so, if I have been misled by such error to inflict pain on her, your resentment has not been unreasonable. But I shall not scruple to assert, that the serenity of your sister's countenance and air was such as might have given the most acute observer a conviction that, however amiable her temper, her heart was not likely to be easily touched. That I was desirous of believing her indifferent is certain--but I will venture to say that my investigation and decisions are not usually influenced by my hopes or fears. I did not believe her to be indifferent because I wished it; I believed it on impartial conviction, as truly as I wished it in reason. My objections to the marriage were not merely those which I last night acknowledged to have the utmost force of passion to put aside, in my own case; the want of connection could not be so great an evil to my friend as to me. But there were other causes of repugnance; causes which, though still existing, and existing to an equal degree in both instances, I had myself endeavoured to forget, because they were not immediately before me. These causes must be stated, though briefly. The situation of your mother's family, though objectionable, was nothing in comparison to that total want of propriety so frequently, so almost uniformly betrayed by herself, by your three younger sisters, and occasionally even by your father. Pardon me. It pains me to offend you. But amidst your concern for the defects of your nearest relations, and your displeasure at this representation of them, let it give you consolation to consider that, to have conducted yourselves so as to avoid any share of the like censure, is praise no less generally bestowed on you and your elder sister, than it is honourable to the sense and disposition of both. I will only say farther that from what passed that evening, my opinion of all parties was confirmed, and every inducement heightened which could have led me before, to preserve my friend from what I esteemed a most unhappy connection. He left Netherfield for London, on the day following, as you, I am certain, remember, with the design of soon returning.",Chapter 35 (continued),178,592
George Eliot (Mary Anne Evans),Middlemarch,1872,https://www.literaturepage.com/read/middlemarch-402.html,"Mr. Brooke got down at a farmyard-gate, and Dorothea drove on. It is wonderful how much uglier things will look when we only suspect that we are blamed for them. Even our own persons in the glass are apt to change their aspect for us after we have heard some frank remark on their less admirable points; and on the other hand it is astonishing how pleasantly conscience takes our encroachments on those who never complain or have nobody to complain for them. Dagley's homestead never before looked so dismal to Mr. Brooke as it did today, with his mind thus sore about the fault-finding of the ""Trumpet,"" echoed by Sir James. It is true that an observer, under that softening influence of the fine arts which makes other people's hardships picturesque, might have been delighted with this homestead called Freeman's End: the old house had dormer-windows in the dark red roof, two of the chimneys were choked with ivy, the large porch was blocked up with bundles of sticks, and half the windows were closed with gray worm-eaten shutters about which the jasmine-boughs grew in wild luxuriance; the mouldering garden wall with hollyhocks peeping over it was a perfect study of highly mingled subdued color, and there was an aged goat (kept doubtless on interesting superstitious grounds) lying against the open back-kitchen door. The mossy thatch of the cow-shed, the broken gray barn-doors, the pauper laborers in ragged breeches who had nearly finished unloading a wagon of corn into the barn ready for early thrashing; the scanty dairy of cows being tethered for milking and leaving one half of the shed in brown emptiness; the very pigs and white ducks seeming to wander about the uneven neglected yard as if in low spirits from feeding on a too meagre quality of rinsings,-- all these objects under the quiet light of a sky marbled with high clouds would have made a sort of picture which we have all paused over as a ""charming bit,"" touching other sensibilities than those which are stirred by the depression of the agricultural interest, with the sad lack of farming capital, as seen constantly in the newspapers of that time. But these troublesome associations were just now strongly present to Mr. Brooke, and spoiled the scene for him. Mr. Dagley himself made a figure in the landscape, carrying a pitchfork and wearing his milking-hat--a very old beaver flattened in front. His coat and breeches were the best he had, and he would not have been wearing them on this weekday occasion if he had not been to market and returned later than usual, having given himself the rare treat of dining at the public table of the Blue Bull. How he came to fall into this extravagance would perhaps be matter of wonderment to himself on the morrow; but before dinner something in the state of the country, a slight pause in the harvest before the Far Dips were cut, the stories about the new King and the numerous handbills on the walls, had seemed to warrant a little recklessness. It was a maxim about Middlemarch, and regarded as self-evident, that good meat should have good drink, which last Dagley interpreted as plenty of table ale well followed up by rum-and-water. These liquors have so far truth in them that they were not false enough to make poor Dagley seem merry: they only made his discontent less tongue-tied than usual. He had also taken too much in the shape of muddy political talk, a stimulant dangerously disturbing to his farming conservatism, which consisted in holding that whatever is, is bad, and any change is likely to be worse. He was flushed, and his eyes had a decidedly quarrelsome stare as he stood still grasping his pitchfork, while the landlord approached with his easy shuffling walk, one hand in his trouser-pocket and the other swinging round a thin walking-stick.",BOOK IV. THREE LOVE PROBLEMS. 39. CHAPTER XXXIX. (continued),402,653
